library/src/amd_detail/rocblaslt/src/Tensile/Logic/asm_full/aquavanjaram/gfx942/Equality/aquavanjaram_Cijk_Alik_Bljk_F8HS_BH_Bias_AS_SAV_UserArgs.yaml
- {MinimumRequiredVersion: 4.33.0}
- aquavanjaram
- gfx942
- [Device 0049, Device 0050]
    SolutionIndex: 0
    SolutionNameMin: Cijk_Alik_Bljk_F8HS_BH_Bias_AS_SAV_UserArgs_MT256x112x128_MI16x16x1_SN_GRVWA4_GRVWB4_GSU1_LBSPPA512_LBSPPB128_LPA32_LPB32_LRVW16_MIAV0_MIWT4_7_SU8_SUM0_SUS256_SVW4_VWA4_VWB1_WG64_4_1_WGM32
    SolutionIndex: 1
    SolutionNameMin: Cijk_Alik_Bljk_F8HS_BH_Bias_AS_SAV_UserArgs_MT32x16x256_MI16x16x1_SN_GRVWA16_GRVWB16_GSU1_LBSPPA256_LBSPPB256_MIWT1_1_NTA0_NLCA1_NLCB1_SU0_SUM0_SUS0_SVW1_VWA1_WG32_4_2_WGM1
    SolutionIndex: 2
    SolutionNameMin: Cijk_Alik_Bljk_F8HS_BH_Bias_AS_SAV_UserArgs_MT192x224x64_MI16x16x1_SN_CLR1_GRVWA16_GRVWB4_GSU1_LBSPPA128_LBSPPB128_LPA16_LPB8_LRVW8_MIWT6_7_PLR1_SU8_SUM0_SUS256_SVW2_VWA2_VWB1_WG32_8_1_WGM16
    SolutionIndex: 3
    SolutionNameMin: Cijk_Alik_Bljk_F8HS_BH_Bias_AS_SAV_UserArgs_MT32x16x256_MI16x16x1_SN_CLR1_GRVWA16_GRVWB16_GSU16_LBSPPA256_LBSPPB256_LPA32_LPB32_LRVW16_MIWT1_1_NTA4_NLCA1_NLCB1_PLR1_SU0_SUM0_SUS0_SVW1_VWA1_WG32_4_1_WGM1
    SolutionIndex: 4
    SolutionNameMin: Cijk_Alik_Bljk_F8HS_BH_Bias_AS_SAV_UserArgs_MT64x64x256_MI16x16x1_SN_CLR1_GRVWA16_GRVWB4_GSU1_GSUC0_GSUWGMRR0_K1_LBSPPA1024_LBSPPB512_LPA32_LPB32_LRVW16_MIWT4_2_NTC3_NTD3_PLR1_SU0_SUM0_SUS0_SVW4_VWA4_VWB2_WG16_8_2_WGM1_WGMXCC1_WGMXCCGn1
    SolutionIndex: 5
    SolutionNameMin: Cijk_Alik_Bljk_F8HS_BH_Bias_AS_SAV_UserArgs_MT128x224x128_MI16x16x1_SN_GRVWA4_GRVWB16_GSU1_GSUC0_GSUWGMRR0_K1_LBSPPA512_LBSPPB128_LPA32_LPB32_LRVW16_MIAV0_MIWT4_7_SU8_SUM0_SUS256_SVW4_VWA4_VWB1_WG32_8_1_WGM16_WGMXCC1_WGMXCCGn1
    SolutionIndex: 6
    SolutionNameMin: Cijk_Alik_Bljk_F8HS_BH_Bias_AS_SAV_UserArgs_MT256x160x64_MI16x16x1_SN_GRVWA16_GRVWB4_GSU1_GSUC0_GSUWGMRR0_K1_LBSPPA512_LBSPPB128_LPA16_LPB8_LRVW8_MIAV0_MIWT8_5_SU8_SUM0_SUS256_SVW8_VWA8_VWB1_WG32_8_1_WGM32_WGMXCC1_WGMXCCGn1
    SolutionIndex: 7
    SolutionNameMin: Cijk_Alik_Bljk_F8HS_BH_Bias_AS_SAV_UserArgs_MT64x192x128_MI16x16x1_SN_GRVWA16_GRVWB16_GSU1_GSUC0_GSUWGMRR0_K1_LBSPPA512_LBSPPB128_LPA32_LPB32_LRVW16_MIAV1_MIWT4_3_NTC3_NTD3_SU0_SUM0_SUS0_SVW4_VWA4_VWB1_WG16_16_1_WGM1_WGMXCC1_WGMXCCGn1
    SolutionIndex: 8
    SolutionNameMin: Cijk_Alik_Bljk_F8HS_BH_Bias_AS_SAV_UserArgs_MT256x256x64_MI16x16x1_SN_GRVWA16_GRVWB16_GSU1_GSUC0_GSUWGMRR0_K1_LBSPPA512_LBSPPB512_LPA16_LPB16_LRVW8_MIWT8_8_SU8_SUM0_SUS256_SVW8_VWA8_VWB8_WG32_8_1_WGM48_WGMXCC1_WGMXCCGn1
    SolutionIndex: 9
    SolutionNameMin: Cijk_Alik_Bljk_F8HS_BH_Bias_AS_SAV_UserArgs_MT128x256x64_MI16x16x1_SN_GRVWA4_GRVWB4_GSU1_GSUC0_GSUWGMRR0_K1_LBSPPA512_LBSPPB256_LPA8_LPB8_LRVW8_MIWT8_4_SU8_SUM0_SUS256_SVW8_VWA8_VWB4_WG16_16_1_WGM48_WGMXCC1_WGMXCCGn1
    SolutionIndex: 10
    SolutionNameMin: Cijk_Alik_Bljk_F8HS_BH_Bias_AS_SAV_UserArgs_MT256x192x128_MI16x16x1_SN_GRVWA16_GRVWB4_GSU1_GSUC0_GSUWGMRR0_K1_LBSPPA1024_LBSPPB256_LPA32_LPB32_LRVW16_MIAV0_MIWT8_6_SU8_SUM0_SUS256_SVW8_VWA8_VWB2_WG32_8_1_WGM48_WGMXCC1_WGMXCCGn1
    SolutionIndex: 11
    SolutionNameMin: Cijk_Alik_Bljk_F8HS_BH_Bias_AS_SAV_UserArgs_MT128x128x128_MI16x16x1_SN_GRVWA16_GRVWB16_GSU1_GSUC0_GSUWGMRR0_K1_LBSPPA1024_LBSPPB256_LPA32_LPB32_LRVW16_MIAV1_MIWT8_2_SU8_SUM0_SUS256_SVW8_VWA8_VWB2_WG16_16_1_WGM16_WGMXCC1_WGMXCCGn1
    SolutionIndex: 12
    SolutionNameMin: Cijk_Alik_Bljk_F8HS_BH_Bias_AS_SAV_UserArgs_MT64x128x128_MI32x32x1_SN_GRVWA4_GRVWB4_GSU1_GSUC0_GSUWGMRR0_K1_LBSPPA256_LBSPPB128_LPA16_LPB16_LRVW16_MIAV1_MIWT2_1_SU8_SUM0_SUS256_SVW2_VWA2_VWB1_WG32_8_1_WGMn16_WGMXCC1_WGMXCCGn1
    SolutionIndex: 13
    SolutionNameMin: Cijk_Alik_Bljk_F8HS_BH_Bias_AS_SAV_UserArgs_MT256x192x128_MI16x16x1_SN_GRVWA16_GRVWB16_GSU1_GSUC0_GSUWGMRR0_K1_LBSPPA1024_LBSPPB256_LPA32_LPB32_LRVW16_MIAV0_MIWT8_6_SU8_SUM0_SUS256_SVW8_VWA8_VWB2_WG32_8_1_WGM48_WGMXCC1_WGMXCCGn1
    SolutionIndex: 14
    SolutionNameMin: Cijk_Alik_Bljk_F8HS_BH_Bias_AS_SAV_UserArgs_MT64x112x256_MI16x16x1_SN_CLR1_GRVWA16_GRVWB4_GSU1_GSUC0_GSUWGMRR0_K1_LBSPPA512_LBSPPB256_LPA32_LPB32_LRVW16_MIAV1_MIWT2_7_NTC0_NTD0_PLR1_SU0_SUM0_SUS0_SVW2_VWA2_VWB1_WG32_4_2_WGM1_WGMXCC1_WGMXCCGn1
    SolutionIndex: 15
    SolutionNameMin: Cijk_Alik_Bljk_F8HS_BH_Bias_AS_SAV_UserArgs_MT128x352x128_MI16x16x1_SN_GRVWA16_GRVWB4_GSU1_GSUC0_GSUWGMRR0_K1_LBSPPA512_LBSPPB128_LPA16_LPB8_LRVW8_MIAV0_MIWT4_11_SU8_SUM0_SUS256_SVW4_VWA4_VWB1_WG32_8_1_WGM16_WGMXCC1_WGMXCCGn1
- - - [6144, 8192, 1, 768]
    - [2, 0.0]
  - - [1024, 8192, 1, 6400]
    - [0, 0.0]
  - - [1024, 8, 1, 6400]
    - [3, 0.0]
  - - [6144, 8, 1, 768]
    - [1, 0.0]
  - - [1024, 1024, 1, 1024]
    - [4, 0.0]
  - - [1024, 8192, 1, 4096]
    - [5, 0.0]
  - - [4096, 8192, 1, 1024]
    - [6, 0.0]
  - - [3072, 1024, 1, 1024]
    - [7, 0.0]
  - - [3072, 24576, 1, 1024]
    - [8, 0.0]
  - - [4096, 24576, 1, 1024]
    - [9, 0.0]
  - - [1024, 24576, 1, 1024]
    - [10, 0.0]
  - - [1024, 8192, 1, 1024]
    - [11, 0.0]
  - - [4096, 1024, 1, 1024]
    - [12, 0.0]
  - - [1024, 24576, 1, 4096]
    - [13, 0.0]
  - - [1024, 1024, 1, 4096]
    - [14, 0.0]
  - - [3072, 8192, 1, 1024]
    - [15, 0.0]
- null
- null
- DeviceEfficiency
- Equality
